{"$schema":"https://json-schema.org/draft/2020-12/schema","$id":"schema://frank.object-manifest/v1","type":"object","additionalProperties":false,"required":["schema","object_id","cell_id","bucket","object_key","sha256","size_bytes","media_type","created_at","source_ref","security","extraction","retention"],"properties":{"schema":{"const":"schema://frank.object-manifest/v1"},"object_id":{"type":"string"},"cell_id":{"type":"string"},"bucket":{"enum":["frank-objects","frank-quarantine","frank-extracts"]},"object_key":{"type":"string"},"sha256":{"pattern":"^sha256:[a-f0-9]{64}$","type":"string"},"size_bytes":{"type":"integer","minimum":0},"media_type":{"type":"string"},"original_name":{"type":"string"},"relative_path":{"type":"string"},"created_at":{"type":"string","format":"date-time"},"source_ref":{"type":"object","additionalProperties":false,"required":["kind","id"],"properties":{"kind":{"type":"string"},"id":{"type":"string"},"version":{"type":"string"}}},"security":{"type":"object","required":["scan_state"],"properties":{"scan_state":{"enum":["pending","clean","blocked","failed"]},"scanned_at":{"type":"string","format":"date-time"}}},"extraction":{"type":"object","required":["state","preview_object_ids"],"properties":{"state":{"enum":["none","pending","complete","failed"]},"text_object_id":{"type":"string"},"preview_object_ids":{"type":"array","items":{"type":"string"}}}},"retention":{"type":"object","required":["class"],"properties":{"class":{"type":"string"},"expires_at":{"type":"string","format":"date-time"}}}}}
