{"schema":"schema://frank.object-manifest/v1","object_id":"obj_01","cell_id":"cell_01","bucket":"frank-objects","object_key":"sha256/aa/aaaaaaaaaaaaaaaaaaaaaaaaaaaaaaaaaaaaaaaaaaaaaaaaaaaaaaaaaaaaaaaa","sha256":"aaaaaaaaaaaaaaaaaaaaaaaaaaaaaaaaaaaaaaaaaaaaaaaaaaaaaaaaaaaaaaaa","size_bytes":12,"media_type":"text/plain","created_at":"2026-08-11T00:00:00Z","source_ref":{"kind":"attachment","id":"att_01"},"security":{"scan_state":"clean","scanned_at":"2026-08-11T00:00:00Z"},"extraction":{"state":"complete","preview_object_ids":[]},"retention":{"class":"standard"}}
